{
  "archive": {
    "file_count": 14,
    "filenames": [
      "agency.txt",
      "calendar.txt",
      "calendar_dates.txt",
      "fare_attributes.txt",
      "fare_rules.txt",
      "feed_info.txt",
      "gtfs.xsd",
      "routes.txt",
      "services",
      "shapes.txt",
      "stop_times.txt",
      "stops.txt",
      "transfers.txt",
      "trips.txt"
    ]
  },
  "calendar": {
    "end_date": {
      "maximum": "20200523",
      "minimum": "20200523"
    },
    "rows": 10,
    "service_ids": 10,
    "start_date": {
      "maximum": "20200216",
      "minimum": "20200216"
    }
  },
  "calendar_dates": {
    "date": {
      "maximum": "20200522",
      "minimum": "20200218"
    },
    "exception_types": [
      "1"
    ],
    "rows": 275,
    "service_ids": 6
  },
  "entities": {
    "agencies": {
      "rows": 1,
      "unique_ids": 1
    },
    "routes": {
      "rows": 20,
      "unique_ids": 20
    },
    "service_ids_in_trips": 10,
    "stops": {
      "rows": 923,
      "unique_ids": 923
    },
    "trips": {
      "rows": 3563,
      "unique_ids": 3563
    }
  },
  "feed_info": [
    {
      "feed_end_date": "20200620",
      "feed_lang": "en",
      "feed_publisher_name": "Big Blue Bus",
      "feed_publisher_url": "http://www.bigbluebus.com",
      "feed_start_date": "20200216",
      "feed_version": "2020-02 (Feb)_20200121"
    }
  ],
  "identities": {
    "routes": [
      "3134",
      "3135",
      "3136",
      "3138",
      "3140",
      "3141",
      "3142",
      "3143",
      "3144",
      "3145",
      "3146",
      "3147",
      "3148",
      "3149",
      "3151",
      "3152",
      "3153",
      "3154",
      "3155",
      "3156"
    ],
    "service_ids_in_trips": [
      "1",
      "10",
      "12010",
      "2",
      "40510",
      "77710",
      "79010",
      "85510",
      "87510",
      "92610"
    ],
    "stops": [
      "1001",
      "1002",
      "1017",
      "1021",
      "1023",
      "1027",
      "1028",
      "1030",
      "1031",
      "104",
      "1048",
      "1049",
      "1050",
      "1051",
      "1053",
      "1058",
      "1059",
      "106",
      "1060",
      "1061",
      "1062",
      "1064",
      "1065",
      "1066",
      "1067",
      "1068",
      "1069",
      "1082",
      "1083",
      "1084",
      "1085",
      "1086",
      "1087",
      "1088",
      "1089",
      "1090",
      "1092",
      "1093",
      "1094",
      "1095",
      "1096",
      "1097",
      "1098",
      "1099",
      "11",
      "110",
      "1100",
      "1101",
      "1106",
      "1107",
      "1108",
      "1109",
      "111",
      "1110",
      "1115",
      "1125",
      "1126",
      "1129",
      "1131",
      "1133",
      "1134",
      "1135",
      "1138",
      "1139",
      "1145",
      "1146",
      "1147",
      "1148",
      "1149",
      "115",
      "1150",
      "1151",
      "1154",
      "1167",
      "117",
      "118",
      "1184",
      "1186",
      "1187",
      "1188",
      "119",
      "1196",
      "1198",
      "1199",
      "120",
      "1200",
      "1201",
      "1217",
      "1234",
      "1235",
      "1236",
      "1238",
      "1240",
      "1242",
      "1243",
      "1246",
      "1258",
      "1260",
      "1261",
      "1262",
      "1263",
      "1265",
      "1270",
      "1278",
      "1279",
      "128",
      "1280",
      "1282",
      "1287",
      "1288",
      "1291",
      "13",
      "1301",
      "1302",
      "1305",
      "1307",
      "1308",
      "131",
      "1310",
      "1311",
      "1312",
      "1313",
      "1314",
      "1315",
      "1317",
      "1319",
      "132",
      "1323",
      "1328",
      "133",
      "1330",
      "1338",
      "1343",
      "1344",
      "1345",
      "1348",
      "135",
      "1350",
      "1351",
      "1352",
      "1353",
      "1354",
      "1355",
      "1358",
      "1359",
      "1360",
      "1361",
      "1362",
      "1363",
      "1364",
      "1365",
      "1366",
      "1367",
      "1368",
      "1369",
      "1370",
      "1371",
      "1372",
      "1373",
      "1374",
      "1375",
      "1376",
      "1377",
      "1378",
      "1379",
      "1381",
      "1382",
      "1383",
      "1384",
      "1386",
      "1387",
      "1388",
      "1389",
      "1391",
      "1392",
      "1393",
      "1394",
      "1399",
      "140",
      "1400",
      "1401",
      "1404",
      "1405",
      "1409",
      "1410",
      "1415",
      "1421",
      "1422",
      "1423",
      "1424",
      "1425",
      "1427",
      "1428",
      "1430",
      "1431",
      "1432",
      "1433",
      "1434",
      "1435",
      "1436",
      "1437",
      "1438",
      "1440",
      "1441",
      "1442",
      "1443",
      "1444",
      "1446",
      "1447",
      "1448",
      "1450",
      "1451",
      "1452",
      "1455",
      "1456",
      "1457",
      "1458",
      "1459",
      "1460",
      "1462",
      "1463",
      "1464",
      "1465",
      "1466",
      "1467",
      "1468",
      "1469",
      "1470",
      "1471",
      "1472",
      "1474",
      "1475",
      "1476",
      "1477",
      "1478",
      "1479",
      "1480",
      "1481",
      "1482",
      "1483",
      "1484",
      "1485",
      "1486",
      "1487",
      "1488",
      "1489",
      "149",
      "1490",
      "1492",
      "1493",
      "1494",
      "1497",
      "1498",
      "1499",
      "150",
      "151",
      "1511",
      "1512",
      "1513",
      "1514",
      "1515",
      "1516",
      "1517",
      "1518",
      "1519",
      "1520",
      "1521",
      "1522",
      "1523",
      "1528",
      "1529",
      "1530",
      "1531",
      "1532",
      "1533",
      "1534",
      "1535",
      "1536",
      "1537",
      "1538",
      "1539",
      "154",
      "1541",
      "1542",
      "1543",
      "1544",
      "1545",
      "1546",
      "1547",
      "1548",
      "1549",
      "155",
      "1550",
      "1551",
      "1552",
      "1553",
      "1554",
      "1555",
      "1556",
      "1557",
      "1558",
      "1559",
      "1560",
      "1561",
      "1562",
      "1563",
      "1564",
      "1566",
      "1567",
      "1568",
      "1569",
      "1570",
      "1572",
      "1573",
      "1574",
      "1575",
      "1577",
      "1578",
      "1579",
      "1580",
      "1581",
      "1582",
      "1584",
      "1585",
      "1586",
      "1588",
      "1589",
      "1590",
      "1591",
      "1593",
      "1594",
      "1595",
      "1597",
      "1598",
      "1602",
      "1603",
      "1604",
      "1605",
      "1606",
      "1607",
      "1608",
      "1609",
      "161",
      "1610",
      "1614",
      "1615",
      "1616",
      "1617",
      "1618",
      "1619",
      "1620",
      "1621",
      "1622",
      "1632",
      "1635",
      "1636",
      "1637",
      "1638",
      "1639",
      "1640",
      "1641",
      "1642",
      "1643",
      "1646",
      "165",
      "166",
      "167",
      "168",
      "170",
      "171",
      "178",
      "179",
      "184",
      "185",
      "187",
      "188",
      "195",
      "198",
      "20",
      "202",
      "205",
      "206",
      "21",
      "214",
      "218",
      "219",
      "22",
      "221",
      "224",
      "225",
      "226",
      "227",
      "228",
      "229",
      "230",
      "231",
      "232",
      "236",
      "240",
      "241",
      "242",
      "245",
      "246",
      "248",
      "249",
      "253",
      "254",
      "255",
      "257",
      "258",
      "261",
      "262",
      "264",
      "267",
      "272",
      "274",
      "275",
      "276",
      "277",
      "278",
      "279",
      "28",
      "283",
      "284",
      "286",
      "288",
      "289",
      "29",
      "290",
      "291",
      "292",
      "296",
      "297",
      "298",
      "299",
      "3",
      "30",
      "300",
      "302",
      "303",
      "304",
      "306",
      "307",
      "309",
      "310",
      "314",
      "316",
      "317",
      "319",
      "321",
      "322",
      "323",
      "324",
      "325",
      "326",
      "327",
      "330",
      "331",
      "332",
      "333",
      "334",
      "335",
      "336",
      "337",
      "338",
      "339",
      "34",
      "340",
      "341",
      "343",
      "344",
      "345",
      "346",
      "347",
      "348",
      "349",
      "350",
      "351",
      "352",
      "353",
      "354",
      "355",
      "356",
      "357",
      "358",
      "359",
      "360",
      "361",
      "362",
      "363",
      "364",
      "365",
      "366",
      "367",
      "368",
      "369",
      "370",
      "373",
      "374",
      "375",
      "376",
      "377",
      "378",
      "379",
      "38",
      "381",
      "382",
      "384",
      "385",
      "387",
      "388",
      "389",
      "391",
      "392",
      "393",
      "394",
      "395",
      "396",
      "397",
      "398",
      "4",
      "400",
      "401",
      "402",
      "403",
      "405",
      "406",
      "407",
      "408",
      "409",
      "41",
      "410",
      "411",
      "412",
      "413",
      "414",
      "415",
      "416",
      "417",
      "418",
      "419",
      "42",
      "420",
      "421",
      "422",
      "423",
      "426",
      "427",
      "428",
      "43",
      "430",
      "431",
      "432",
      "433",
      "434",
      "435",
      "436",
      "437",
      "438",
      "44",
      "441",
      "45",
      "455",
      "46",
      "460",
      "469",
      "47",
      "474",
      "476",
      "477",
      "48",
      "480",
      "481",
      "486",
      "487",
      "488",
      "489",
      "490",
      "491",
      "492",
      "493",
      "494",
      "495",
      "496",
      "497",
      "499",
      "5",
      "50",
      "500",
      "501",
      "502",
      "503",
      "504",
      "505",
      "51",
      "519",
      "52",
      "520",
      "523",